{
  "metadata": {
    "name": "General Transit Feed Specification Reference",
    "revision_date": "2026-04-27",
    "revision_history_url": "https://gtfs.org/schedule/process/#revision-history",
    "description": "This document defines the format and structure of the files that comprise a GTFS dataset."
  },
  "document_conventions": {
    "description": "The key words \"MUST\", \"MUST NOT\", \"REQUIRED\", \"SHALL\", \"SHALL NOT\", \"SHOULD\", \"SHOULD NOT\", \"RECOMMENDED\", \"MAY\", and \"OPTIONAL\" in this document are to be interpreted as described in RFC 2119.",
    "term_definitions": {
      "description": "This section defines terms that are used throughout this document.",
      "terms": [
        {
          "term": "Dataset",
          "definition": "A complete set of files defined by this specification reference. Altering the dataset creates a new version of the dataset. Datasets should be published at a public, permanent URL, including the zip file name. (e.g., https://www.agency.org/gtfs/gtfs.zip)."
        },
        {
          "term": "Record",
          "definition": "A basic data structure comprised of a number of different field values describing a single entity (e.g. transit agency, stop, route, etc.). Represented, in a table, as a row."
        },
        {
          "term": "Field",
          "definition": "A property of an object or entity. Represented, in a table, as a column. The field exists if added in a file as a header. It may or may not have field values defined."
        },
        {
          "term": "Field value",
          "definition": "An individual entry in a field. Represented, in a table, as a single cell."
        },
        {
          "term": "Service day",
          "definition": "A service day is a time period used to indicate route scheduling. The exact definition of service day varies from agency to agency but service days often do not correspond with calendar days. A service day may exceed 24:00:00 if service begins on one day and ends on a following day. For example, service that runs from 08:00:00 on Friday to 02:00:00 on Saturday, could be denoted as running from 08:00:00 to 26:00:00 on a single service day."
        },
        {
          "term": "Text-to-speech field",
          "definition": "The field should contain the same information than its parent field (on which it falls back if it is empty). It is aimed to be read as text-to-speech, therefore, abbreviation should be either removed (\"St\" should be either read as \"Street\" or \"Saint\"; \"Elizabeth I\" should be \"Elizabeth the first\") or kept to be read as it (\"JFK Airport\" is said abbreviated)."
        },
        {
          "term": "Leg",
          "definition": "Travel in which a rider boards and alights between a pair of subsequent locations along a trip."
        },
        {
          "term": "Journey",
          "definition": "Overall travel from origin to destination, including all legs and transfers in-between."
        },
        {
          "term": "Sub-journey",
          "definition": "Two or more legs that comprise a subset of a journey."
        },
        {
          "term": "Fare product",
          "definition": "Purchassable fare products that can be used to pay for or validate travel."
        },
        {
          "term": "Effective Fare Leg",
          "definition": "A sub-journey of two or more legs that should be treated as a single leg for matching rules in fare_leg_rules.txt for the purposes of fare calculation."
        }
      ]
    },
    "presence": {
      "description": "Presence conditions applicable to fields and files.",
      "conditions": [
        {
          "name": "Required",
          "definition": "The field or file must be included in the dataset and contain a valid value for each record."
        },
        {
          "name": "Optional",
          "definition": "The field or file may be omitted from the dataset."
        },
        {
          "name": "Conditionally Required",
          "definition": "The field or file must be included under conditions outlined in the field or file description."
        },
        {
          "name": "Conditionally Forbidden",
          "definition": "The field or file must not be included under conditions outlined in the field or file description."
        },
        {
          "name": "Recommended",
          "definition": "The field or file may be omitted from the dataset, but it is a best practice to include it. Before omitting this field or file, the best practice should be carefully evaluated and the full implications of omission should be understood."
        }
      ]
    },
    "field_types": {
      "description": "Field types applicable to fields.",
      "types": [
        {
          "name": "Color",
          "definition": "A color encoded as a six-digit hexadecimal number. Refer to https://htmlcolorcodes.com to generate a valid value (the leading \"#\" must not be included).",
          "example": "FFFFFF for white, 000000 for black or 0039A6 for the A,C,E lines in NYMTA."
        },
        {
          "name": "Currency code",
          "definition": "An ISO 4217 alphabetical currency code. For the list of current currency, refer to https://en.wikipedia.org/wiki/ISO_4217#Active_codes.",
          "example": "CAD for Canadian dollars, EUR for euros or JPY for Japanese yen."
        },
        {
          "name": "Currency amount",
          "definition": "A decimal value indicating a currency amount. The number of decimal places is specified by ISO 4217 for the accompanying Currency code. All financial calculations should be processed as decimal, currency, or another equivalent type suitable for financial calculations depending on the programming language used to consume data. Processing currency amounts as float is discouraged due to gains or losses of money during calculations."
        },
        {
          "name": "Date",
          "definition": "Service day in the YYYYMMDD format. Since time within a service day may be above 24:00:00, a service day may contain information for the subsequent day(s).",
          "example": "20180913 for September 13th, 2018."
        },
        {
          "name": "Email",
          "definition": "An email address.",
          "example": "example@example.com"
        },
        {
          "name": "Enum",
          "definition": "An option from a set of predefined constants defined in the Description column.",
          "example": "The route_type field contains a 0 for tram, a 1 for subway..."
        },
        {
          "name": "ID",
          "definition": "An ID field value is an internal ID, not intended to be shown to riders, and is a sequence of any UTF-8 characters. Using only printable ASCII characters is recommended. An ID is labeled \"unique ID\" when it must be unique within a file. IDs defined in one .txt file are often referenced in another .txt file. IDs that reference an ID in another table are labeled \"foreign ID\".",
          "example": "The `stop_id` field in [stops.txt](#stopstxt) is a \"unique ID\". The `parent_station` field in [stops.txt](#stopstxt) is a \"foreign ID referencing `stops.stop_id`\"."
        },
        {
          "name": "Language code",
          "definition": "An IETF BCP 47 language code. For an introduction to IETF BCP 47, refer to http://www.rfc-editor.org/rfc/bcp/bcp47.txt and http://www.w3.org/International/articles/language-tags/.",
          "example": "`en` for English, `en-US` for American English or `de` for German."
        },
        {
          "name": "Latitude",
          "definition": "WGS84 latitude in decimal degrees. The value must be greater than or equal to -90.0 and less than or equal to 90.0.",
          "example": "`41.890169` for the Colosseum in Rome."
        },
        {
          "name": "Longitude",
          "definition": "WGS84 longitude in decimal degrees. The value must be greater than or equal to -180.0 and less than or equal to 180.0.",
          "example": "`12.492269` for the Colosseum in Rome."
        },
        {
          "name": "Float",
          "definition": "A floating point number."
        },
        {
          "name": "Integer",
          "definition": "An integer."
        },
        {
          "name": "Phone number",
          "definition": "A phone number."
        },
        {
          "name": "Time",
          "definition": "Time in the HH:MM:SS format (H:MM:SS is also accepted). The time is measured from \"noon minus 12h\" of the service day (effectively midnight except for days on which daylight savings time changes occur). For times occurring after midnight on the service day, enter the time as a value greater than 24:00:00 in HH:MM:SS.",
          "example": "`14:30:00` for 2:30PM or `25:35:00` for 1:35AM on the next day."
        },
        {
          "name": "Local time",
          "definition": "Time in the HH:MM:SS format (H:MM:SS is also accepted). Represents a wall-clock time shown in the local time of the specified location."
        },
        {
          "name": "Text",
          "definition": "A string of UTF-8 characters, which is aimed to be displayed and which must therefore be human readable."
        },
        {
          "name": "Timezone",
          "definition": "TZ timezone from the https://www.iana.org/time-zones. Timezone names never contain the space character but may contain an underscore. Refer to http://en.wikipedia.org/wiki/List_of_tz_zones for a list of valid values.",
          "example": "`Asia/Tokyo`, `America/Los_Angeles` or `Africa/Cairo`."
        },
        {
          "name": "URL",
          "definition": "A fully qualified URL that includes http:// or https://, and any special characters in the URL must be correctly escaped. See the following http://www.w3.org/Addressing/URL/4_URI_Recommentations.html for a description of how to create fully qualified URL values."
        }
      ]
    },
    "field_signs": {